{
  "$schema": "./phase4-registry.schema.json",
  "schemaVersion": 1,
  "phase": 4,
  "generatedAt": "2026-08-08",
  "oneAppContract": true,
  "distributionLicense": "GPL-3.0-only",
  "intent": "Complete console coverage. Phase 4 closes the gaps left by Phases 1-3: systems whose Phase 1 engine was recorded as licence-blocked, systems whose engine is built but never packaged, systems whose hardware an approved engine already emulates but which EmuFusion never routes, and notable consoles with no engine in any registry. Every row starts with all gates false and shipped false, exactly like Phases 1-3. Phase 4 identifies candidates and evidence; it pins no source and qualifies nothing.",
  "licensePolicy": {
    "compatible": [
      "GPL-3.0-only", "GPL-3.0-or-later", "GPL-2.0-or-later",
      "LGPL-2.0-or-later", "LGPL-2.1-only", "LGPL-2.1-or-later",
      "LGPL-3.0-only", "LGPL-3.0-or-later",
      "MIT", "MIT-0", "X11", "ISC", "BSD-2-Clause", "BSD-3-Clause",
      "Zlib", "libpng-2.0", "curl", "Apache-2.0", "MPL-2.0",
      "Unlicense", "CC0-1.0", "FSFAP", "ClArtistic", "Artistic-2.0"
    ],
    "incompatible": [
      "GPL-2.0-only", "GPL-1.0-only", "Artistic-1.0", "Artistic-1.0-Perl",
      "CC-BY-NC-4.0", "SSPL-1.0", "BUSL-1.1", "NOASSERTION"
    ],
    "note": "EmuFusion distributes one combined work under GPL-3.0-only. Inbound GPL-2.0-or-later is compatible because the or-later option permits version 3; GPL-2.0-only is not. A bare GPLv2 COPYING or LICENSE document does NOT establish only-versus-or-later: only the per-file grant or an explicit project declaration does. Phase 1 read several COPYING files as GPL-2.0-only and was wrong six times."
  },
  "categories": {
    "misaudited": "An earlier phase recorded a blocking licence for this system's engine, but the pinned upstream licence text contradicts that record. Phase 4 must re-audit the incumbent at file level; it does not need a different engine.",
    "blocked-replacement": "The incumbent engine is genuinely incompatible with GPL-3.0-only distribution. Phase 4 must record a different licence-compatible engine or escalate a product decision.",
    "unpackaged": "An approved, licence-compatible engine already builds but is never staged into the APK.",
    "unadvertised": "An approved, licence-compatible engine already emulates this hardware, but EmuFusion advertises no system id for it and the id does not resolve to any engine.",
    "missing": "No engine exists in any EmuFusion registry for this system."
  },
  "expectedSystems": [
    "atari2600", "atari5200", "atari800", "amstradcpc", "atarist", "c64",
    "odyssey2", "segacd", "sega32x", "virtualboy", "msx", "colecovision",
    "intellivision", "wonderswan", "neogeopocket", "atarilynx",
    "vectrex", "pcfx", "cdi", "x68000"
  ],
  "engines": [
    {
      "id": "stella-reaudit",
      "systems": ["atari2600"],
      "category": "misaudited",
      "priorEngine": "stella-2023",
      "priorPhase": 1,
      "blocker": "Phase 1 recorded Stella as GPL-2.0-only with no evidence field and blocked it. The upstream licence grant says version 2 or any later version, so the block does not hold. A file-level re-audit and an Android ARM64 build proof are still required.",
      "status": "research",
      "candidate": {
        "name": "Stella",
        "repository": "https://github.com/stella-emu/stella",
        "license": {
          "spdx": "GPL-2.0-or-later",
          "correctsRecordedSpdx": "GPL-2.0-only",
          "distributionGate": "audit-required",
          "evidence": "Copyright.txt grants the work \"under the terms of the GNU General Public License as published by the Free Software Foundation; either version 2 of the License, or any later version.\" EmuFusion's own registry recorded GPL-2.0-only with an empty evidence field. Stella's License.txt is the bare GPLv2 document, which is what the Phase 1 reading appears to have been based on; a GPLv2 document does not decide only-versus-or-later.",
          "evidenceUrl": "https://raw.githubusercontent.com/stella-emu/stella/master/Copyright.txt"
        },
        "androidArm64": {
          "route": "libretro-core",
          "evidence": "Stella maintains its own in-tree libretro core at src/os/libretro/, including jni/Application.mk containing \"APP_STL := c++_static\", \"APP_ABI := all\" and \"APP_CPPFLAGS := -fexceptions\", so an NDK arm64-v8a build is an upstream-supported target rather than a third-party fork."
        },
        "firmware": {
          "required": false,
          "note": "The Atari 2600 needs no BIOS. Phase 1 already recorded firmware.required=false for this system, so no firmware gate work is implied."
        },
        "rationale": "The incumbent engine was never actually incompatible, so the accurate and actively maintained upstream is available at no cost. Preferring upstream Stella over the libretro/stella2023 fork EmuFusion pinned also moves EmuFusion onto a core the Stella team maintains themselves.",
        "rejectedAlternatives": [
          {
            "name": "Gopher2600",
            "repository": "https://github.com/JetSetIlly/Gopher2600",
            "license": "GPL-3.0-or-later",
            "reason": "Licence is a perfect match and the project is very active, but it is a Go plus SDL plus imgui desktop application with no libretro core and no Android target, so it cannot enter EmuFusion's in-process host."
          },
          {
            "name": "stella2014-libretro",
            "repository": "https://github.com/libretro/stella2014-libretro",
            "license": "GPL-2.0-or-later",
            "reason": "Compatible and has a working jni build, but it is frozen at 2014-era accuracy and is strictly worse than current Stella now that the licence objection has gone."
          },
          {
            "name": "MAME a2600 driver",
            "repository": "https://github.com/mamedev/mame",
            "license": "GPL-2.0-or-later",
            "reason": "The driver file itself is BSD-3-Clause, but a driver cannot run without the MAME framework and MAME is a far heavier dependency than a dedicated 2600 core for no accuracy gain."
          }
        ]
      },
      "gates": {"source": false, "license": false, "dependencies": false, "androidArm64": false, "firmware": false, "legalContent": false, "renderer": false, "state": false, "performance": false, "device": false},
      "shipped": false
    },
    {
      "id": "atari800-reaudit",
      "systems": ["atari5200", "atari800"],
      "category": "misaudited",
      "priorEngine": "atari800",
      "priorPhase": 1,
      "blocker": "Phase 1 recorded atari800 as GPL-2.0-only with no evidence field. Every sampled core source file grants version 2 or any later version. A file-level re-audit is required, and the packaging metadata contradiction below must be resolved before the licence gate can close.",
      "status": "research",
      "note": "Packaging metadata in the upstream tree (debian/copyright and atari800.spec) says GPLv2 without the or-later qualifier, while the per-file copyright grants say or-later. Per-file grants are authoritative, but the contradiction is real and should be recorded in the re-audit rather than glossed over.",
      "candidate": {
        "name": "Atari800",
        "repository": "https://github.com/libretro/libretro-atari800",
        "license": {
          "spdx": "GPL-2.0-or-later",
          "correctsRecordedSpdx": "GPL-2.0-only",
          "distributionGate": "audit-required",
          "evidence": "src/atari.c states \"Atari800 is free software; you can redistribute it and/or modify it under the terms of the GNU General Public License as published by the Free Software Foundation; either version 2 of the License, or (at your option) any later version.\" The same grant appears in antic.c, gtia.c, pokey.c, cartridge.c, memory.c, pia.c and binload.c.",
          "evidenceUrl": "https://raw.githubusercontent.com/atari800/atari800/master/src/atari.c"
        },
        "androidArm64": {
          "route": "libretro-core",
          "evidence": "The libretro fork carries jni/Android.mk and jni/Application.mk and is listed in libretro-super recipes/android/cores-android, so arm64-v8a is an existing upstream build target."
        },
        "firmware": {
          "required": false,
          "freeReplacement": "AltirraOS, bundled in the atari800 tree under emuos/ (FSFAP all-permissive)",
          "note": "The proprietary Atari OS and BASIC ROMs are NOT required. atari800 bundles AltirraOS, Avery Lee's clean-room replacement, whose emuos/LICENSE reads \"Copying and distribution of this file, with or without modification, are permitted in any medium without royalty provided the copyright notice and this notice are preserved.\" The libretro core-info marks all seven Atari ROM entries firmware_opt=true because the built-in OS covers them. Phase 1 had already recorded firmware.required=false for this row."
        },
        "rationale": "The incumbent engine was never incompatible, and it is the only Atari 8-bit and 5200 option with a proven Android libretro core today. It additionally solves its own firmware problem by bundling an all-permissive clean-room OS, which removes any user-supplied-ROM requirement for this system.",
        "rejectedAlternatives": [
          {
            "name": "AltirraSDL",
            "repository": "https://github.com/ilmenit/AltirraSDL",
            "license": "GPL-2.0-or-later",
            "reason": "More accurate than atari800 and licence-compatible (its headers inherit Altirra's version 2 or later grant, contradicting the project website's GPLv2 summary), but its libretro core targets only Linux, Windows and macOS; the Android target is a standalone SDL3 app, not a core EmuFusion could host."
          },
          {
            "name": "MAME a5200/a800 drivers",
            "repository": "https://github.com/mamedev/mame",
            "license": "GPL-2.0-or-later",